{
  "$schema": "https://json-schema.org/draft/2020-12/schema",
  "type": "object",
  "required": ["name", "owner", "metadata", "plugins"],
  "properties": {
    "name": {"type": "string", "minLength": 1},
    "owner": {"type": "object"},
    "metadata": {"type": "object"},
    "plugins": {
      "type": "array",
      "items": {
        "type": "object",
        "required": ["name", "source", "description", "version", "category"],
        "properties": {
          "name": {"type": "string", "minLength": 1},
          "source": {"type": "string", "minLength": 1},
          "description": {"type": "string", "minLength": 1},
          "version": {"type": "string", "minLength": 1},
          "category": {"type": "string", "minLength": 1}
        },
        "additionalProperties": true
      }
    }
  },
  "additionalProperties": true
}
