{
  "name": "specterops-skills",
  "owner": {
    "name": "SpecterOps"
  },
  "metadata": {
    "description": "SpecterOps skills, plugins, and agents for offensive security and engineering workflows",
    "pluginRoot": "./plugins"
  },
  "plugins": [
    {
      "name": "workflows-development",
      "source": "./plugins/workflows-development",
      "description": "Development scaffolding, repository hygiene, security tooling, and implementation workflows for Specter Codex.",
      "version": "0.1.0",
      "category": "productivity"
    },
    {
      "name": "code-review-and-qa",
      "source": "./plugins/code-review-and-qa",
      "description": "Code review and web application QA workflows for Specter Codex.",
      "version": "0.1.0",
      "category": "productivity"
    },
    {
      "name": "workflows-research",
      "source": "./plugins/workflows-research",
      "description": "Source-backed research and synthesis workflows for Specter Codex.",
      "version": "0.1.0",
      "category": "productivity"
    },
    {
      "name": "ops-reconnaissance",
      "source": "./plugins/ops-reconnaissance",
      "description": "Reconnaissance, OSINT, service enumeration, and exposure discovery workflows for Specter Codex.",
      "version": "0.1.0",
      "category": "security"
    },
    {
      "name": "ops-appsec",
      "source": "./plugins/ops-appsec",
      "description": "Application and code security assessment workflows for Specter Codex.",
      "version": "0.1.0",
      "category": "security"
    },
    {
      "name": "ops-sccm",
      "source": "./plugins/ops-sccm",
      "description": "Microsoft Configuration Manager reconnaissance and takeover validation workflows.",
      "version": "0.1.0",
      "category": "security"
    },
    {
      "name": "bloodhound",
      "source": "./plugins/bloodhound",
      "description": "BloodHound, AzureHound, GitHound/JamfHound/OktaHound OpenGraph attack-path query workflows, SCIM bridge references, and optional BloodHound MCP packaging.",
      "version": "0.1.0",
      "category": "security"
    },
    {
      "name": "payloads",
      "source": "./plugins/payloads",
      "description": "Reusable Electron payload packaging, persistence, audit, and discovery workflows.",
      "version": "0.1.0",
      "category": "security"
    },
    {
      "name": "c2-extensions",
      "source": "./plugins/c2-extensions",
      "description": "Beacon Object File development and reusable C2 extension workflows.",
      "version": "0.1.0",
      "category": "security"
    },
    {
      "name": "report-drafting",
      "source": "./plugins/report-drafting",
      "description": "Finding, report drafting, Ghostwriter MCP, and operation log workflows for security assessment deliverables.",
      "version": "0.1.0",
      "category": "productivity"
    },
    {
      "name": "reverse-engineering",
      "source": "./plugins/reverse-engineering",
      "description": "Reverse engineering workflows and MCP-assisted binary analysis for Binary Ninja, Ghidra, and related tooling.",
      "version": "0.1.0",
      "category": "security"
    },
    {
      "name": "report-timeline",
      "source": "./plugins/report-timeline",
      "description": "Report timeline ingestion, consolidation, and evidence packaging workflows.",
      "version": "0.1.0",
      "category": "productivity"
    },
    {
      "name": "codex-observability",
      "source": "./plugins/codex-observability",
      "description": "Codex activity reporting and telemetry workflows.",
      "version": "0.1.0",
      "category": "productivity"
    },
    {
      "name": "ops-infrastructure",
      "source": "./plugins/ops-infrastructure",
      "description": "Infrastructure operations, SSH, tunnel, firewall, and offensive IaC attack-surface workflows.",
      "version": "0.1.0",
      "category": "infrastructure"
    },
    {
      "name": "social-engineering",
      "source": "./plugins/social-engineering",
      "description": "Social engineering research and phishing pretext workflows.",
      "version": "0.1.0",
      "category": "security"
    },
    {
      "name": "ludus",
      "source": "./plugins/ludus",
      "description": "Ludus cyber range configuration and management skill with full API, CLI, and deployment references",
      "version": "0.2.0",
      "category": "security"
    },
    {
      "name": "c2-mythic",
      "source": "./plugins/c2-mythic",
      "description": "Mythic C2 framework implant and C2 profile development workflows with agent message protocols, payload type definitions, and listener/profile guidance.",
      "version": "0.1.0",
      "category": "security"
    },
    {
      "name": "c2-cobaltstrike",
      "source": "./plugins/c2-cobaltstrike",
      "description": "Cobalt Strike operations, Aggressor Script, Sleep, BOF loader, and Malleable C2 profile workflows.",
      "version": "0.1.0",
      "category": "security"
    },
    {
      "name": "go-review",
      "source": "./plugins/go-review",
      "description": "Security review for Go packages and services covering trust boundaries, injection, filesystem, crypto, concurrency, and unsafe/cgo edges",
      "version": "0.3.0",
      "category": "security"
    },
    {
      "name": "c2-outflankc2",
      "source": "./plugins/c2-outflankc2",
      "description": "Outflank C2 (OC2) operations, BOF scripts, and event-driven bot development workflows.",
      "version": "0.2.0",
      "category": "security"
    }
  ]
}
